[
  {
    "schema_version": 1,
    "correlation_id": "supervisor",
    "generation_id": "33333333-3333-4333-8333-333333333333",
    "sequence": 1,
    "event": "supervisor.ready",
    "gateway_id": null,
    "runtime_id": null,
    "runtime_generation": null,
    "data": {
      "protocol_version": 1,
      "cli_version": "0.6.12",
      "capabilities": [
        "gateway.supervise.multi"
      ],
      "max_gateways": 16,
      "max_runtimes_per_gateway": 16,
      "max_runtimes": 64,
      "process_inventory": null
    }
  },
  {
    "schema_version": 1,
    "correlation_id": "attach-gateway-1",
    "generation_id": "33333333-3333-4333-8333-333333333333",
    "sequence": 2,
    "event": "gateway.attached",
    "gateway_id": "kalkidan-0123456789abcdef0123456789abcdef",
    "runtime_id": null,
    "runtime_generation": null,
    "data": {
      "gateway_id": "kalkidan-0123456789abcdef0123456789abcdef",
      "agent_id": "44444444-4444-4444-8444-444444444444",
      "state": "listening",
      "effective_address": "http://127.0.0.1:47011",
      "runtimes": []
    }
  },
  {
    "schema_version": 1,
    "correlation_id": "gateway",
    "generation_id": "33333333-3333-4333-8333-333333333333",
    "sequence": 3,
    "event": "runtime.starting",
    "gateway_id": "kalkidan-0123456789abcdef0123456789abcdef",
    "runtime_id": "66666666-6666-4666-8666-666666666666",
    "runtime_generation": 1,
    "data": {
      "runtime_id": "66666666-6666-4666-8666-666666666666",
      "session_id": "66666666-6666-4666-8666-666666666666"
    }
  },
  {
    "schema_version": 1,
    "correlation_id": "attach-runtime-1",
    "generation_id": "33333333-3333-4333-8333-333333333333",
    "sequence": 4,
    "event": "runtime.attached",
    "gateway_id": "kalkidan-0123456789abcdef0123456789abcdef",
    "runtime_id": "66666666-6666-4666-8666-666666666666",
    "runtime_generation": 1,
    "data": {
      "gateway_id": "kalkidan-0123456789abcdef0123456789abcdef",
      "runtime_id": "66666666-6666-4666-8666-666666666666",
      "session_id": "66666666-6666-4666-8666-666666666666",
      "state": "listening",
      "effective_address": "http://127.0.0.1:47011",
      "ready": false,
      "reason_code": "desktop.readiness_required",
      "expires_at": "2026-10-22T12:10:00Z"
    }
  },
  {
    "schema_version": 1,
    "correlation_id": "attach-runtime-2",
    "generation_id": "33333333-3333-4333-8333-333333333333",
    "sequence": 5,
    "event": "runtime.attached",
    "gateway_id": "kalkidan-0123456789abcdef0123456789abcdef",
    "runtime_id": "77777777-7777-4777-8777-777777777777",
    "runtime_generation": 1,
    "data": {
      "gateway_id": "kalkidan-0123456789abcdef0123456789abcdef",
      "runtime_id": "77777777-7777-4777-8777-777777777777",
      "session_id": "77777777-7777-4777-8777-777777777777",
      "state": "listening",
      "effective_address": "http://127.0.0.1:47011",
      "ready": false,
      "reason_code": "desktop.readiness_required",
      "expires_at": "2026-10-22T12:10:00Z"
    }
  },
  {
    "schema_version": 1,
    "correlation_id": "status-1",
    "generation_id": "33333333-3333-4333-8333-333333333333",
    "sequence": 6,
    "event": "gateway.status",
    "gateway_id": "kalkidan-0123456789abcdef0123456789abcdef",
    "runtime_id": null,
    "runtime_generation": null,
    "data": {
      "gateway_id": "kalkidan-0123456789abcdef0123456789abcdef",
      "agent_id": "44444444-4444-4444-8444-444444444444",
      "state": "listening",
      "effective_address": "http://127.0.0.1:47011",
      "runtimes": [
        {
          "gateway_id": "kalkidan-0123456789abcdef0123456789abcdef",
          "runtime_id": "66666666-6666-4666-8666-666666666666",
          "session_id": "66666666-6666-4666-8666-666666666666",
          "state": "listening",
          "effective_address": "http://127.0.0.1:47011",
          "ready": false,
          "reason_code": "desktop.readiness_required",
          "expires_at": "2026-10-22T12:10:00Z"
        },
        {
          "gateway_id": "kalkidan-0123456789abcdef0123456789abcdef",
          "runtime_id": "77777777-7777-4777-8777-777777777777",
          "session_id": "77777777-7777-4777-8777-777777777777",
          "state": "listening",
          "effective_address": "http://127.0.0.1:47011",
          "ready": false,
          "reason_code": "desktop.readiness_required",
          "expires_at": "2026-10-22T12:10:00Z"
        }
      ]
    }
  },
  {
    "schema_version": 1,
    "correlation_id": "list-1",
    "generation_id": "33333333-3333-4333-8333-333333333333",
    "sequence": 7,
    "event": "gateway.list",
    "gateway_id": null,
    "runtime_id": null,
    "runtime_generation": null,
    "data": {
      "gateways": [
        {
          "gateway_id": "kalkidan-0123456789abcdef0123456789abcdef",
          "agent_id": "44444444-4444-4444-8444-444444444444",
          "state": "listening",
          "effective_address": "http://127.0.0.1:47011",
          "runtimes": [
            {
              "gateway_id": "kalkidan-0123456789abcdef0123456789abcdef",
              "runtime_id": "66666666-6666-4666-8666-666666666666",
              "session_id": "66666666-6666-4666-8666-666666666666",
              "state": "listening",
              "effective_address": "http://127.0.0.1:47011",
              "ready": false,
              "reason_code": "desktop.readiness_required",
              "expires_at": "2026-10-22T12:10:00Z"
            },
            {
              "gateway_id": "kalkidan-0123456789abcdef0123456789abcdef",
              "runtime_id": "77777777-7777-4777-8777-777777777777",
              "session_id": "77777777-7777-4777-8777-777777777777",
              "state": "listening",
              "effective_address": "http://127.0.0.1:47011",
              "ready": false,
              "reason_code": "desktop.readiness_required",
              "expires_at": "2026-10-22T12:10:00Z"
            }
          ]
        }
      ]
    }
  },
  {
    "schema_version": 1,
    "correlation_id": "renew-1",
    "generation_id": "33333333-3333-4333-8333-333333333333",
    "sequence": 8,
    "event": "credential.renewed",
    "gateway_id": "kalkidan-0123456789abcdef0123456789abcdef",
    "runtime_id": "66666666-6666-4666-8666-666666666666",
    "runtime_generation": 2,
    "data": {
      "gateway_id": "kalkidan-0123456789abcdef0123456789abcdef",
      "runtime_id": "66666666-6666-4666-8666-666666666666",
      "session_id": "66666666-6666-4666-8666-666666666666",
      "state": "listening",
      "effective_address": "http://127.0.0.1:47011",
      "ready": false,
      "reason_code": "desktop.readiness_required",
      "expires_at": "2026-10-22T12:20:00Z"
    }
  },
  {
    "schema_version": 1,
    "correlation_id": "detach-runtime-2",
    "generation_id": "33333333-3333-4333-8333-333333333333",
    "sequence": 9,
    "event": "runtime.stopping",
    "gateway_id": "kalkidan-0123456789abcdef0123456789abcdef",
    "runtime_id": "77777777-7777-4777-8777-777777777777",
    "runtime_generation": 1,
    "data": {}
  },
  {
    "schema_version": 1,
    "correlation_id": "gateway",
    "generation_id": "33333333-3333-4333-8333-333333333333",
    "sequence": 10,
    "event": "runtime.stopped",
    "gateway_id": "kalkidan-0123456789abcdef0123456789abcdef",
    "runtime_id": "77777777-7777-4777-8777-777777777777",
    "runtime_generation": 1,
    "data": {
      "reason": "stopped"
    }
  },
  {
    "schema_version": 1,
    "correlation_id": "gateway",
    "generation_id": "33333333-3333-4333-8333-333333333333",
    "sequence": 11,
    "event": "credential.revoked",
    "gateway_id": "kalkidan-0123456789abcdef0123456789abcdef",
    "runtime_id": "66666666-6666-4666-8666-666666666666",
    "runtime_generation": 2,
    "data": {
      "runtime_id": "66666666-6666-4666-8666-666666666666",
      "reason": "runtime_revoked"
    }
  },
  {
    "schema_version": 1,
    "correlation_id": "gateway",
    "generation_id": "33333333-3333-4333-8333-333333333333",
    "sequence": 12,
    "event": "runtime.stopped",
    "gateway_id": "kalkidan-0123456789abcdef0123456789abcdef",
    "runtime_id": "66666666-6666-4666-8666-666666666666",
    "runtime_generation": 2,
    "data": {
      "reason": "revoked"
    }
  },
  {
    "schema_version": 1,
    "correlation_id": "gateway",
    "generation_id": "33333333-3333-4333-8333-333333333333",
    "sequence": 13,
    "event": "error",
    "gateway_id": "kalkidan-0123456789abcdef0123456789abcdef",
    "runtime_id": "77777777-7777-4777-8777-777777777777",
    "runtime_generation": 1,
    "data": {
      "code": "desktop.gateway_unavailable",
      "retryable": false,
      "failure_stage": "startup",
      "failure_kind": "network",
      "http_status": 503,
      "category": "gateway",
      "recovery_action": "repair_gateway"
    }
  },
  {
    "schema_version": 1,
    "correlation_id": "attach-gateway-17",
    "generation_id": "33333333-3333-4333-8333-333333333333",
    "sequence": 14,
    "event": "error",
    "gateway_id": "kalkidan-fedcba9876543210fedcba9876543210",
    "runtime_id": null,
    "runtime_generation": null,
    "data": {
      "code": "desktop.gateway_limit",
      "retryable": false,
      "limit": 16
    }
  },
  {
    "schema_version": 1,
    "correlation_id": "detach-gateway-1",
    "generation_id": "33333333-3333-4333-8333-333333333333",
    "sequence": 15,
    "event": "gateway.stopping",
    "gateway_id": "kalkidan-0123456789abcdef0123456789abcdef",
    "runtime_id": null,
    "runtime_generation": null,
    "data": {}
  },
  {
    "schema_version": 1,
    "correlation_id": "gateway",
    "generation_id": "33333333-3333-4333-8333-333333333333",
    "sequence": 16,
    "event": "gateway.stopped",
    "gateway_id": "kalkidan-0123456789abcdef0123456789abcdef",
    "runtime_id": null,
    "runtime_generation": null,
    "data": {
      "reason": "stopped"
    }
  },
  {
    "schema_version": 1,
    "correlation_id": "shutdown-1",